{
  "schemaVersion": 1,
  "documentType": "flv-tag-detail",
  "source": {
    "sizeBytes": 76
  },
  "tag": {
    "id": 0,
    "typeCode": 18,
    "typeName": "script",
    "offset": 13,
    "span": {
      "byteOffset": 13,
      "bitOffset": 0,
      "bitLength": 472
    },
    "headerSpan": {
      "byteOffset": 13,
      "bitOffset": 0,
      "bitLength": 88
    },
    "payloadSpan": {
      "byteOffset": 24,
      "bitOffset": 0,
      "bitLength": 384
    },
    "rawTypeFlags": 18,
    "filter": false,
    "dataSize": 48,
    "availableDataSize": 48,
    "dts": 0,
    "streamId": 0,
    "payloadComplete": true,
    "previousTagSize": {
      "present": true,
      "span": {
        "byteOffset": 72,
        "bitOffset": 0,
        "bitLength": 32
      },
      "value": 59,
      "expected": 59,
      "valid": true
    }
  },
  "detail": {
    "kind": "amf0ScriptData",
    "span": {
      "byteOffset": 24,
      "bitOffset": 0,
      "bitLength": 384
    },
    "bytesConsumed": 48,
    "complete": true,
    "eventName": "onMetaData",
    "eventNameNodeId": 0,
    "valueNodeId": 1,
    "roots": [
      0,
      1
    ],
    "nodes": [
      {
        "id": 0,
        "childCount": 0,
        "typeCode": 2,
        "typeName": "string",
        "complete": true,
        "span": {
          "byteOffset": 24,
          "bitOffset": 0,
          "bitLength": 104
        },
        "markerSpan": {
          "byteOffset": 24,
          "bitOffset": 0,
          "bitLength": 8
        },
        "string": {
          "length": 10,
          "lengthSpan": {
            "byteOffset": 25,
            "bitOffset": 0,
            "bitLength": 16
          },
          "span": {
            "byteOffset": 27,
            "bitOffset": 0,
            "bitLength": 80
          },
          "omitted": false,
          "value": "onMetaData"
        }
      },
      {
        "id": 1,
        "firstChildId": 2,
        "childCount": 2,
        "typeCode": 8,
        "typeName": "ecmaArray",
        "complete": true,
        "span": {
          "byteOffset": 37,
          "bitOffset": 0,
          "bitLength": 280
        },
        "markerSpan": {
          "byteOffset": 37,
          "bitOffset": 0,
          "bitLength": 8
        },
        "terminatorSpan": {
          "byteOffset": 69,
          "bitOffset": 0,
          "bitLength": 24
        },
        "count": {
          "declared": {
            "value": 2,
            "span": {
              "byteOffset": 38,
              "bitOffset": 0,
              "bitLength": 32
            }
          },
          "actual": 2
        }
      },
      {
        "id": 2,
        "parentId": 1,
        "nextSiblingId": 3,
        "childCount": 0,
        "propertyId": 0,
        "typeCode": 0,
        "typeName": "number",
        "complete": true,
        "span": {
          "byteOffset": 52,
          "bitOffset": 0,
          "bitLength": 72
        },
        "markerSpan": {
          "byteOffset": 52,
          "bitOffset": 0,
          "bitLength": 8
        },
        "number": {
          "bits": "3ff8000000000000",
          "class": "finite",
          "span": {
            "byteOffset": 53,
            "bitOffset": 0,
            "bitLength": 64
          },
          "value": 1.5
        }
      },
      {
        "id": 3,
        "parentId": 1,
        "childCount": 0,
        "propertyId": 1,
        "typeCode": 1,
        "typeName": "boolean",
        "complete": true,
        "span": {
          "byteOffset": 67,
          "bitOffset": 0,
          "bitLength": 16
        },
        "markerSpan": {
          "byteOffset": 67,
          "bitOffset": 0,
          "bitLength": 8
        },
        "boolean": {
          "raw": 1,
          "value": true,
          "span": {
            "byteOffset": 68,
            "bitOffset": 0,
            "bitLength": 8
          }
        }
      }
    ],
    "properties": [
      {
        "id": 0,
        "parentNodeId": 1,
        "valueNodeId": 2,
        "span": {
          "byteOffset": 42,
          "bitOffset": 0,
          "bitLength": 152
        },
        "name": {
          "length": 8,
          "lengthSpan": {
            "byteOffset": 42,
            "bitOffset": 0,
            "bitLength": 16
          },
          "span": {
            "byteOffset": 44,
            "bitOffset": 0,
            "bitLength": 64
          },
          "omitted": false,
          "value": "duration"
        }
      },
      {
        "id": 1,
        "parentNodeId": 1,
        "valueNodeId": 3,
        "span": {
          "byteOffset": 61,
          "bitOffset": 0,
          "bitLength": 64
        },
        "name": {
          "length": 4,
          "lengthSpan": {
            "byteOffset": 61,
            "bitOffset": 0,
            "bitLength": 16
          },
          "span": {
            "byteOffset": 63,
            "bitOffset": 0,
            "bitLength": 32
          },
          "omitted": false,
          "value": "live"
        }
      }
    ],
    "stringBytes": 22
  },
  "diagnostics": []
}
